id,name,description,user_id,description_length
1,Ashely Cantrell,Vero irure fugiat est fugit laudantium iste vero et nulla deleniti delectus aperiam recusandae Suscipit labore in ex,2,0.7051282051282052
2,Lucian Ferrell,Beatae tempor eiusmod saepe excepturi sint optio accusamus optio vel quos vitae animi reprehenderit facilis ut et deserunt repudiandae anim,3,0.9999999999999999
3,Dale Ramsey,Fugit sint sapiente molestiae atque autem reprehenderit voluptas dolore mollitia aut eveniet,3,0.39743589743589747
5,Charissa Graham,Et quis lorem temporibus reprehenderit est sunt dolores excepturi sunt quidem possimus,6,0.3205128205128204
6,Scott Schultz,Quibusdam omnis fuga Ut quod mollitia anim in dolor ullam autem aut magnam dolor impedit sint sapiente,6,0.5256410256410257
7,Imogene Nguyen,Duis nisi at voluptas at eum fugiat aliquid pariatur Natus ut,6,0.0
8,Katelyn Becker,Voluptatem dolores deserunt impedit dolores numquam velit doloremque labore saepe quo id sint Nam ut totam est,6,0.6282051282051281
